{
  "$schema": "http://json-schema.org/draft-07/schema#",
  "title": "End-to-End Test Definition",
  "description": "Defines a single end-to-end test for the Hardhat test harness.",
  "type": "object",
  "required": [
    "description",
    "repo",
    "commit",
    "packageManager",
    "defaultCommand",
    "tags"
  ],
  "additionalProperties": false,
  "properties": {
    "$schema": { "type": "string" },
    "description": {
      "type": "string",
      "description": "Short human-readable summary of what this scenario tests"
    },
    "repo": {
      "type": "string",
      "description": "GitHub repo in org/name format (e.g. OpenZeppelin/openzeppelin-contracts)"
    },
    "commit": {
      "type": "string",
      "description": "Full SHA or tag to checkout"
    },
    "packageManager": {
      "type": "string",
      "enum": ["npm", "bun", "yarn", "pnpm"],
      "description": "Package manager used by the repo"
    },
    "defaultCommand": {
      "type": "string",
      "description": "Default command to run when --command is not provided to exec"
    },
    "preinstall": {
      "type": "string",
      "description": "Relative path to a shell script for patching the repo before install"
    },
    "install": {
      "type": "string",
      "description": "Relative path to a custom install script (overrides built-in Verdaccio flow)"
    },
    "tags": {
      "type": "array",
      "items": { "type": "string" },
      "minItems": 1,
      "description": "Tags for filtering (e.g. [\"solidity-compile\", \"solidity-test\"])"
    },
    "env": {
      "type": "object",
      "additionalProperties": { "type": "string" },
      "description": "Environment variables to set during install/exec. Values may reference host variables with the devcontainer-style token ${localEnv:NAME} (e.g. \"FOUNDRY_RPC_URL\": \"${localEnv:ALCHEMY_URL}\"); the referenced host variable must be set or the run will fail."
    },
    "submodules": {
      "type": "boolean",
      "description": "Initialize git submodules recursively (default: false)"
    },
    "disabled": {
      "type": "boolean",
      "const": true,
      "description": "Set to true to skip this scenario during end-to-end runs"
    },
    "benchmark": {
      "type": "object",
      "additionalProperties": false,
      "anyOf": [{ "required": ["skip"] }, { "required": ["commands"] }],
      "properties": {
        "skip": {
          "type": "boolean",
          "const": true,
          "description": "Set to true to skip this scenario in the regression benchmark"
        },
        "commands": {
          "type": "object",
          "minProperties": 1,
          "propertyNames": {
            "type": "string",
            "minLength": 1
          },
          "additionalProperties": {
            "type": "object",
            "oneOf": [
              {
                "additionalProperties": false,
                "required": ["runs", "command"],
                "properties": {
                  "runs": {
                    "type": "integer",
                    "minimum": 1,
                    "description": "Number of hyperfine runs for this command"
                  },
                  "prepare": {
                    "type": "string",
                    "minLength": 1,
                    "description": "Optional shell snippet to run before each timed run (passed to hyperfine --prepare)"
                  },
                  "command": {
                    "type": "string",
                    "minLength": 1,
                    "description": "Shell command to benchmark"
                  }
                }
              },
              {
                "additionalProperties": false,
                "required": ["runs", "steps"],
                "properties": {
                  "runs": {
                    "type": "integer",
                    "minimum": 1,
                    "description": "Number of times to run the whole step sequence"
                  },
                  "steps": {
                    "type": "object",
                    "minProperties": 1,
                    "propertyNames": {
                      "type": "string",
                      "minLength": 1,
                      "pattern": "^(?!\\d+$).+"
                    },
                    "additionalProperties": {
                      "type": "object",
                      "additionalProperties": false,
                      "required": ["command"],
                      "properties": {
                        "command": {
                          "type": "string",
                          "minLength": 1,
                          "description": "Shell command for this step"
                        },
                        "measure": {
                          "type": "boolean",
                          "description": "Emit a benchmark entry for this step (default true)"
                        }
                      }
                    },
                    "description": "Ordered steps run as a sequence, repeated `runs` times. Each step is timed individually in-process; the key becomes the benchmark name on disk for measured steps."
                  }
                }
              }
            ]
          },
          "description": "Named commands to benchmark. Iterated in definition order; the key becomes the benchmark name on disk. Each entry is either a single hyperfine command or an in-process step sequence."
        }
      },
      "description": "Benchmark configuration for pnpm bench and pnpm bench:regression"
    }
  }
}
