{
  "$schema": "../../scripts/end-to-end/schema/scenario.schema.json",
  "description": "1inch Network Fusion Atomic Swaps fork to Hardhat 3.",
  "tags": ["external-repo"],
  "repo": "Wodann/cross-chain-swap",
  "commit": "690f7f6bbc826ab3d58995e4bc5bf01694222086",
  "packageManager": "yarn",
  "submodules": true,
  "defaultCommand": "npx hardhat test solidity",
  "env": {
    "FOUNDRY_PROFILE": "default"
  },
  "benchmark": {
    "commands": {
      "compile sequence": {
        "runs": 3,
        "steps": {
          "reset files & cache": {
            "command": "git checkout -- test/libraries/FeeCalcLib.t.sol && git checkout -- test/integration/ResolverMock.t.sol && git checkout -- contracts/BaseEscrow.sol && npx hardhat clean",
            "measure": false
          },
          "cold compile": {
            "command": "npx hardhat compile"
          },
          "edit & compile Solidity test with min deps: test/libraries/FeeCalcLib.t.sol": {
            "command": "printf \"\\n// hardhat benchmark edit\\n\" >> test/libraries/FeeCalcLib.t.sol && npx hardhat compile"
          },
          "edit & compile Solidity test with max deps: test/integration/ResolverMock.t.sol": {
            "command": "printf \"\\n// hardhat benchmark edit\\n\" >> test/integration/ResolverMock.t.sol && npx hardhat compile"
          },
          "edit & compile Solidity contract: contracts/BaseEscrow.sol": {
            "command": "printf \"\\n// hardhat benchmark edit\\n\" >> contracts/BaseEscrow.sol && npx hardhat compile"
          }
        }
      },
      "warm compile": {
        "runs": 97,
        "command": "npx hardhat compile"
      },
      "test solidity": {
        "runs": 9,
        "command": "npx hardhat test solidity --no-compile"
      }
    }
  }
}
