{
  "$schema": "../../scripts/end-to-end/schema/scenario.schema.json",
  "description": "1inch Aqua Protocol fork to Hardhat 3.",
  "tags": ["external-repo"],
  "repo": "anaPerezGhiglia/aqua",
  "commit": "19277969b5e67b5b55968422b4cba4029544807c",
  "packageManager": "yarn",
  "submodules": false,
  "defaultCommand": "npx hardhat test solidity",
  "benchmark": {
    "commands": {
      "compile sequence": {
        "runs": 5,
        "steps": {
          "reset files & cache": {
            "command": "git checkout -- test/AquaLifecycle.t.sol && git checkout -- test/AquaStorageTest.t.sol && git checkout -- src/Aqua.sol && npx hardhat clean",
            "measure": false
          },
          "cold compile": {
            "command": "npx hardhat compile"
          },
          "edit & compile Solidity test with min deps: test/AquaLifecycle.t.sol": {
            "command": "printf \"\\n// hardhat benchmark edit\\n\" >> test/AquaLifecycle.t.sol && npx hardhat compile"
          },
          "edit & compile Solidity test with max deps: test/AquaStorageTest.t.sol": {
            "command": "printf \"\\n// hardhat benchmark edit\\n\" >> test/AquaStorageTest.t.sol && npx hardhat compile"
          },
          "edit & compile Solidity contract: src/Aqua.sol": {
            "command": "printf \"\\n// hardhat benchmark edit\\n\" >> src/Aqua.sol && npx hardhat compile"
          }
        }
      },
      "warm compile": {
        "runs": 55,
        "command": "npx hardhat compile"
      },
      "test solidity": {
        "runs": 83,
        "command": "npx hardhat test solidity --no-compile"
      }
    }
  }
}
