{
  "$schema": "../../scripts/end-to-end/schema/scenario.schema.json",
  "description": "Aave v4 fork to Hardhat 3.",
  "tags": ["external-repo"],
  "repo": "anaPerezGhiglia/aave-v4",
  "commit": "f729aeff7cc61d576e8f89e818e05265ec9f65e9",
  "packageManager": "yarn",
  "submodules": true,
  "defaultCommand": "npx hardhat test solidity",
  "benchmark": {
    "commands": {
      "compile sequence": {
        "runs": 3,
        "steps": {
          "reset files & cache": {
            "command": "git checkout -- tests/unit/WadRayMath.t.sol && git checkout -- tests/unit/Spoke/Liquidations/Spoke.LiquidationCall.t.sol && git checkout -- src/libraries/math/MathUtils.sol && npx hardhat clean",
            "measure": false
          },
          "cold compile": {
            "command": "npx hardhat compile"
          },
          "edit & compile Solidity test with min deps: tests/unit/WadRayMath.t.sol": {
            "command": "printf \"\\n// hardhat benchmark edit\\n\" >> tests/unit/WadRayMath.t.sol && npx hardhat compile"
          },
          "edit & compile Solidity test with max deps: tests/unit/Spoke/Liquidations/Spoke.LiquidationCall.t.sol": {
            "command": "printf \"\\n// hardhat benchmark edit\\n\" >> tests/unit/Spoke/Liquidations/Spoke.LiquidationCall.t.sol && npx hardhat compile"
          },
          "edit & compile Solidity contract: src/libraries/math/MathUtils.sol": {
            "command": "printf \"\\n// hardhat benchmark edit\\n\" >> src/libraries/math/MathUtils.sol && npx hardhat compile"
          }
        }
      },
      "warm compile": {
        "runs": 39,
        "command": "npx hardhat compile"
      },
      "test solidity": {
        "runs": 3,
        "command": "npx hardhat test solidity --no-compile"
      }
    }
  }
}
