{
  "$schema": "../../scripts/end-to-end/schema/scenario.schema.json",
  "description": "1inch SwapVM contract fork to Hardhat 3.",
  "tags": ["external-repo"],
  "repo": "anaPerezGhiglia/1inch-swap-vm",
  "commit": "eacd08361caf75431d2b4409136cf4eb10fa63a3",
  "packageManager": "pnpm",
  "submodules": false,
  "defaultCommand": "npx hardhat test solidity",
  "benchmark": {
    "commands": {
      "compile sequence": {
        "runs": 3,
        "steps": {
          "reset files & cache": {
            "command": "git checkout -- test/ProtocolFeeProviderMock.t.sol && git checkout -- test/TransferModesCombinations.t.sol && git checkout -- src/SwapVM.sol && npx hardhat clean",
            "measure": false
          },
          "cold compile": {
            "command": "npx hardhat compile"
          },
          "edit & compile Solidity test with min deps: test/ProtocolFeeProviderMock.t.sol": {
            "command": "printf \"\\n// hardhat benchmark edit\\n\" >> test/ProtocolFeeProviderMock.t.sol && npx hardhat compile"
          },
          "edit & compile Solidity test with max deps: test/TransferModesCombinations.t.sol": {
            "command": "printf \"\\n// hardhat benchmark edit\\n\" >> test/TransferModesCombinations.t.sol && npx hardhat compile"
          },
          "edit & compile Solidity contract: src/SwapVM.sol": {
            "command": "printf \"\\n// hardhat benchmark edit\\n\" >> src/SwapVM.sol && npx hardhat compile"
          }
        }
      },
      "warm compile": {
        "runs": 45,
        "command": "npx hardhat compile"
      },
      "test solidity": {
        "runs": 29,
        "command": "npx hardhat test solidity --no-compile"
      }
    }
  }
}
